{
  "$schema": "https://agent-plugins.org/schemas/1.0.0/plugin.schema.json",
  "name": "microsoft-fabric",
  "version": "0.1.0",
  "description": "Skills for data engineering in Microsoft Fabric: incremental, idempotent loads into Lakehouse Delta tables from notebooks, with secrets from Azure Key Vault and routine table maintenance. Bundles the read-only Microsoft Learn MCP server for current documentation.",
  "author": {
    "name": "Enterprise Agent Skills contributors",
    "url": "https://github.com/enterprise-agent-skills/enterprise-agent-skills"
  },
  "homepage": "https://github.com/enterprise-agent-skills/enterprise-agent-skills/tree/main/plugins/microsoft-fabric",
  "repository": "https://github.com/enterprise-agent-skills/enterprise-agent-skills",
  "license": "MIT",
  "keywords": [
    "microsoft",
    "fabric",
    "lakehouse",
    "delta-lake",
    "pyspark",
    "notebooks",
    "onelake",
    "data-engineering"
  ]
}
