{
  "name": "microsoft-fabric",
  "displayName": "Microsoft Fabric Data Engineering",
  "version": "0.1.0",
  "description": "Skills for data engineering in Microsoft Fabric: incremental, idempotent loads into Lakehouse Delta tables from notebooks, with secrets from Azure Key Vault and routine table maintenance. Bundles the read-only Microsoft Learn MCP server for current documentation.",
  "author": {
    "name": "Frontier Agent Skills and Plugins contributors",
    "url": "https://github.com/frontier-agent-skills/frontier-agent-skills-plugins"
  },
  "homepage": "https://github.com/frontier-agent-skills/frontier-agent-skills-plugins/tree/main/plugins/microsoft-fabric",
  "repository": "https://github.com/frontier-agent-skills/frontier-agent-skills-plugins",
  "license": "MIT",
  "keywords": [
    "microsoft",
    "fabric",
    "lakehouse",
    "delta-lake",
    "pyspark",
    "notebooks",
    "onelake",
    "data-engineering"
  ]
}
