{
  "$schema": "https://agent-plugins.org/schemas/1.0.0/plugin.schema.json",
  "name": "salesforce-platform",
  "version": "0.1.0",
  "description": "Skills for Salesforce Platform development with Apex: bulk-safe trigger handlers, recursion control, user-mode data access, and tests that cover full 200-record trigger batches.",
  "author": {
    "name": "Enterprise Agent Skills contributors",
    "url": "https://github.com/enterprise-agent-skills/enterprise-agent-skills"
  },
  "homepage": "https://github.com/enterprise-agent-skills/enterprise-agent-skills/tree/main/plugins/salesforce-platform",
  "repository": "https://github.com/enterprise-agent-skills/enterprise-agent-skills",
  "license": "MIT",
  "keywords": [
    "salesforce",
    "apex",
    "triggers",
    "soql",
    "governor-limits",
    "unit-testing",
    "sfdx"
  ]
}
